Feature Name,Clean Feature Name,Target,Diameter,Center Latitude,Center Longitude,Coordinate System,Feature Type,Approval Status,Origin
8 Homeward,8 Homeward,Moon,12.52,-12.02,97.09,"Planetographic, +East, -180 - 180","Crater, craters",Approved,"Crater visible in the iconic “Earthrise” colour photograph, taken aboard Apollo 8 by W. A. Anders on December 24, 1968, symbolizes the safe return to Earth of Apollo 8. The crater was previously designated Ganskiy (Hansky) M."
Abbe,Abbe,Moon,63.98,-57.58,174.77,"Planetographic, +East, -180 - 180","Crater, craters",Approved,"Ernst Karl; German optician, physicist, astronomer (1840-1905)."
Abbot,Abbot,Moon,10.40,5.56,54.74,"Planetographic, +East, -180 - 180","Crater, craters",Approved,Charles Greeley; American astrophysicist (1872-1973).
Abel,Abel,Moon,137.35,-34.63,85.78,"Planetographic, +East, -180 - 180","Crater, craters",Approved,Niels Henrik; Norwegian mathematician (1802-1829).
Abenezra,Abenezra,Moon,43.19,-20.99,11.89,"Planetographic, +East, -180 - 180","Crater, craters",Approved,"Abraham ben Meir Ibn Ezra; Spanish mathematician, astronomer (1092-1164/1167)."
Abetti,Abetti,Moon,1.60,20.11,27.82,"Planetographic, +East, -180 - 180","Crater, craters",Approved,Antonio; Italian astronomer (1846-1928); Giorgio; Italian astronomer (1882-1982).
Abulfeda,Abulfeda,Moon,62.23,-13.87,13.91,"Planetographic, +East, -180 - 180","Crater, craters",Approved,Ismail Ibn Abū al-Fidā; Syrian geographer (1273-1331).
Abul Wáfa,Abul Wafa,Moon,54.18,0.96,116.63,"Planetographic, +East, -180 - 180","Crater, craters",Approved,"Abū al-Wafā al-Būzajāni; Persian mathematician, astronomer (940-998)."
Acosta,Acosta,Moon,13.06,-5.65,60.14,"Planetographic, +East, -180 - 180","Crater, craters",Approved,"Cristobal; Portuguese doctor, natural historian (1515-1580)."
Adams,Adams,Moon,63.27,-31.89,68.39,"Planetographic, +East, -180 - 180","Crater, craters",Approved,John Couch; British astronomer (1819-1892); Charles Hitchcock; American astronomer (1868-1951); Walter Sydney; American astronomer (1876-1956).
Aepinus,Aepinus,Moon,16.74,87.96,-109.69,"Planetographic, +East, -180 - 180","Crater, craters",Approved,Franz Maria Ulrich Theodor Hoch; German-Russian astronomer (1724-1802).
Agatharchides,Agatharchides,Moon,51.98,-19.85,-31.11,"Planetographic, +East, -180 - 180","Crater, craters",Approved,Agatharchides of Cnidos; Greek geographer (c. 116 B.C.).
Agrippa,Agrippa,Moon,43.75,4.10,10.47,"Planetographic, +East, -180 - 180","Crater, craters",Approved,Greek astronomer (unkn-fl. A.D. 92).
Airy,Airy,Moon,38.90,-18.14,5.61,"Planetographic, +East, -180 - 180","Crater, craters",Approved,George Biddell; British astronomer (1801-1892).
Aitken,Aitken,Moon,129.69,-16.44,172.96,"Planetographic, +East, -180 - 180","Crater, craters",Approved,Robert Grant; American astronomer (1864-1951).
Akis,Akis,Moon,2.28,20.01,-31.76,"Planetographic, +East, -180 - 180","Crater, craters",Approved,Greek female name.
Alan,Alan,Moon,1.44,-10.93,-6.17,"Planetographic, +East, -180 - 180","Crater, craters",Approved,Irish male name.
Al-Bakri,Al Bakri,Moon,12.21,14.34,20.25,"Planetographic, +East, -180 - 180","Crater, craters",Approved,Abū Ubayd Abdallāh Ibn abd al-Azīz Ibn Muhammad; Spanish-Arab geographer (1010-1094).
Albategnius,Albategnius,Moon,130.84,-11.24,4.01,"Planetographic, +East, -180 - 180","Crater, craters",Approved,"Muhammed Ben Geber Al-Battānī; Arab astronomer, mathematician (c. 858-929)."
Albert,Albert,Moon,0.10,38.32,-35.01,"Planetographic, +East, -180 - 180","Crater, craters",Approved,Male name of German origin (Lunokhod-1 landing site feature).
Al-Biruni,Al Biruni,Moon,80.41,18.07,92.62,"Planetographic, +East, -180 - 180","Crater, craters",Approved,"Abū ar-Rayhān Muhammad ibn Ahmad al-Birūnī; Persian astronomer, mathematician, geographer (973-1048)."
Alden,Alden,Moon,111.44,-23.51,111.11,"Planetographic, +East, -180 - 180","Crater, craters",Approved,Harold Lee; American astronomer (1890-1964).
Alder,Alder,Moon,82.12,-48.63,-177.88,"Planetographic, +East, -180 - 180","Crater, craters",Approved,Kurt; German organic chemist; Nobel laureate (1902-1958).
Aldrin,Aldrin,Moon,2.80,1.41,22.09,"Planetographic, +East, -180 - 180","Crater, craters",Approved,"Edwin Eugene, Jr. (“;Buzz“;); American astronaut (1930-Live)."
Alekhin,Alekhin,Moon,74.82,-67.94,-131.85,"Planetographic, +East, -180 - 180","Crater, craters",Approved,"Nikolaj Pavlovich; Soviet rocket designer, engineer (1913-1964)."
Alexander,Alexander,Moon,94.80,40.25,13.69,"Planetographic, +East, -180 - 180","Crater, craters",Approved,"Alexander the Great, of Macedon; Greek geographer (356-323 B.C.)."
Alfraganus,Alfraganus,Moon,20.52,-5.42,18.97,"Planetographic, +East, -180 - 180","Crater, craters",Approved,"Al-Fargani, Abu'l-'Abbās Ahmad Ibn Muhammad Ibn Kathīr; Persian astronomer (unkn-c. 840)."
Alhazen,Alhazen,Moon,34.65,15.91,71.83,"Planetographic, +East, -180 - 180","Crater, craters",Approved,Abū Ali Al-Hasan Ibn Al Haitham; Iraqi mathematician (987-1038).
Aliacensis,Aliacensis,Moon,79.65,-30.60,5.13,"Planetographic, +East, -180 - 180","Crater, craters",Approved,"D'Ailly, Pierre; French geographer (1350-1420)."
Al-Khwarizmi,Al Khwarizmi,Moon,56.25,7.02,107.01,"Planetographic, +East, -180 - 180","Crater, craters",Approved,Abū Ja'far Muhammad Ibn Mūsā; Iraqi mathematician (unkn-after 847).
Almanon,Almanon,Moon,47.76,-16.85,15.14,"Planetographic, +East, -180 - 180","Crater, craters",Approved,Abdalla Al Mamun; Persian astronomer (786-833).
Al-Marrakushi,Al Marrakushi,Moon,8.57,-10.45,55.77,"Planetographic, +East, -180 - 180","Crater, craters",Approved,"Abū `Ali al-Hasan Ibn `Ali al-Marrakushi; Moroccan astronomer, mathematician (fl. c. A.D. 1281/1282)."
Aloha,Aloha,Moon,2.55,29.79,-53.88,"Planetographic, +East, -180 - 180","Crater, craters",Approved,Hawaiian female first name.
Alpetragius,Alpetragius,Moon,40.02,-16.05,-4.51,"Planetographic, +East, -180 - 180","Crater, craters",Approved,"Al-Bitrūjī Al-Ishbīlī, Abū Ishāq; Spanish astronomer (unkn-c. 1100)."
Alphonsus,Alphonsus,Moon,110.54,-13.39,-2.85,"Planetographic, +East, -180 - 180","Crater, craters",Approved,Alfonso X (El Sabio); Spanish astronomer (1221-1284).
Alter,Alter,Moon,64.73,18.74,-107.80,"Planetographic, +East, -180 - 180","Crater, craters",Approved,"Dinsmore; American astronomer, meteorologist (1888-1968)."
Ameghino,Ameghino,Moon,9.20,3.30,57.04,"Planetographic, +East, -180 - 180","Crater, craters",Approved,Fiorino (or Florentino); Argentine paleontologist and anthropologist (1854-1911).
Amici,Amici,Moon,52.03,-10.06,-172.23,"Planetographic, +East, -180 - 180","Crater, craters",Approved,"Giovanni Battista; Italian astronomer, optician (1786-1863)."
Ammonius,Ammonius,Moon,8.55,-8.52,-0.83,"Planetographic, +East, -180 - 180","Crater, craters",Approved,Greek philosopher (unkn.-c. A.D. 517-526).
Amontons,Amontons,Moon,2.47,-5.34,46.78,"Planetographic, +East, -180 - 180","Crater, craters",Approved,Guillaume; French physicist (1663-1705).
Amundsen,Amundsen,Moon,103.39,-84.44,83.07,"Planetographic, +East, -180 - 180","Crater, craters",Approved,Roald Engelbregt Gravning; Norwegian explorer (1872-1928).
Anaxagoras,Anaxagoras,Moon,51.90,73.48,-10.17,"Planetographic, +East, -180 - 180","Crater, craters",Approved,Greek astronomer (500-428 B.C.).
Anaximander,Anaximander,Moon,68.71,66.97,-51.44,"Planetographic, +East, -180 - 180","Crater, craters",Approved,Greek astronomer (c. 611-547 B.C.).
Anaximenes,Anaximenes,Moon,81.12,72.49,-44.98,"Planetographic, +East, -180 - 180","Crater, craters",Approved,Greek astronomer (585-528 B.C.).
Anděl,Andel,Moon,32.93,-10.41,12.38,"Planetographic, +East, -180 - 180","Crater, craters",Approved,Karel; Czechoslovakian astronomer (1884-1948).
Anders,Anders,Moon,41.33,-41.31,-143.30,"Planetographic, +East, -180 - 180","Crater, craters",Approved,William Alison; American astronaut (1933-Live).
Anders' Earthrise,Anders Earthrise,Moon,40.15,-11.73,100.47,"Planetographic, +East, -180 - 180","Crater, craters",Approved,"Crater visible in the foreground of the iconic “Earthrise” colour photograph, taken aboard Apollo 8 by W. A. Anders on December 24, 1968, showing the Earth and part of the Moon’s surface. The crater was previously designated Pasteur T."
Anderson,Anderson,Moon,105.33,15.50,170.79,"Planetographic, +East, -180 - 180","Crater, craters",Approved,John August; American astronomer (1876-1959).
Andersson,Andersson,Moon,13.42,-49.95,-95.46,"Planetographic, +East, -180 - 180","Crater, craters",Approved,Leif Erland; American astronomer (1943-1979).
Andronov,Andronov,Moon,16.57,-22.68,146.11,"Planetographic, +East, -180 - 180","Crater, craters",Approved,Aleksandr Aleksandrovich; Soviet physicist (1901-1952).
Ango,Ango,Moon,0.87,20.48,-32.34,"Planetographic, +East, -180 - 180","Crater, craters",Approved,African male name.
Angström,Angstrom,Moon,9.55,29.90,-41.67,"Planetographic, +East, -180 - 180","Crater, craters",Approved,Anders Jonas; Swedish physicist (1814-1874).
Ann,Ann,Moon,2.12,25.11,-0.05,"Planetographic, +East, -180 - 180","Crater, craters",Approved,Hebrew female name.
Annegrit,Annegrit,Moon,1.29,29.43,-25.64,"Planetographic, +East, -180 - 180","Crater, craters",Approved,German female name.
Ansgarius,Ansgarius,Moon,91.42,-12.92,79.72,"Planetographic, +East, -180 - 180","Crater, craters",Approved,St. Ansgar; German theologian (801-864).
Antoniadi,Antoniadi,Moon,137.92,-69.30,-173.06,"Planetographic, +East, -180 - 180","Crater, craters",Approved,Eugène Michael; Turkish-born French astronomer (1870-1944).
Anuchin,Anuchin,Moon,62.14,-48.85,101.66,"Planetographic, +East, -180 - 180","Crater, craters",Approved,Dimitrii Nikolaevich; Russian geographer (1843-1923).
Anville,Anville,Moon,10.26,1.84,49.51,"Planetographic, +East, -180 - 180","Crater, craters",Approved,Jean-Baptiste Bourguignon; French cartographer (1697-1782).
Apianus,Apianus,Moon,63.44,-26.96,7.87,"Planetographic, +East, -180 - 180","Crater, craters",Approved,"Bienewitz, Peter; German mathematician, astronomer (1495-1552)."
Apollo,Apollo,Moon,524.23,-35.69,-151.48,"Planetographic, +East, -180 - 180","Crater, craters",Approved,Named to honor Apollo missions.
Apollonius,Apollonius,Moon,50.66,4.51,60.96,"Planetographic, +East, -180 - 180","Crater, craters",Approved,Apollonius of Perga; Greek mathematician (c. 262-190 B.C.).
Appleton,Appleton,Moon,64.59,37.05,158.17,"Planetographic, +East, -180 - 180","Crater, craters",Approved,Sir Edward Victor; British physicist; Nobel laureate (1892-1965).
Arago,Arago,Moon,25.51,6.15,21.43,"Planetographic, +East, -180 - 180","Crater, craters",Approved,Dominique Francois Jean; French astronomer (1786-1853).
Aratus,Aratus,Moon,10.23,23.58,4.51,"Planetographic, +East, -180 - 180","Crater, craters",Approved,Aratus of Soli; Greek astronomer (c. 310-240/239 B.C.).
Archimedes,Archimedes,Moon,81.04,29.72,-3.99,"Planetographic, +East, -180 - 180","Crater, craters",Approved,"Greek physicist, mathematician (c. 287-212 B.C.)."
Archytas,Archytas,Moon,31.95,58.87,4.99,"Planetographic, +East, -180 - 180","Crater, craters",Approved,Greek mathematician (428-347 B.C. ?).
Argelander,Argelander,Moon,33.72,-16.55,5.80,"Planetographic, +East, -180 - 180","Crater, craters",Approved,Friedrich Wilhelm August; German astronomer (1799-1875).
Ariadaeus,Ariadaeus,Moon,10.40,4.55,17.28,"Planetographic, +East, -180 - 180","Crater, craters",Approved,Philip III of Macedonia; chronologer (c. 358-317 B.C.).
Aristarchus,Aristarchus,Moon,39.99,23.73,-47.49,"Planetographic, +East, -180 - 180","Crater, craters",Approved,Greek astronomer (310-230 B.C. ?).
Aristillus,Aristillus,Moon,54.37,33.88,1.21,"Planetographic, +East, -180 - 180","Crater, craters",Approved,Greek astronomer (fl. c. 280 B.C.).
Aristoteles,Aristoteles,Moon,87.57,50.24,17.32,"Planetographic, +East, -180 - 180","Crater, craters",Approved,"Greek astronomer, philosopher (383-322 B.C.)."
Armiński,Arminski,Moon,26.76,-16.36,154.22,"Planetographic, +East, -180 - 180","Crater, craters",Approved,Franciszek; Polish astronomer (1789-1848). (Spelling changed from Armínski.)
Armstrong,Armstrong,Moon,4.21,1.35,24.94,"Planetographic, +East, -180 - 180","Crater, craters",Approved,Neil Alden; American astronaut (1930-2012).
Arnold,Arnold,Moon,93.13,66.98,35.83,"Planetographic, +East, -180 - 180","Crater, craters",Approved,Christoph; German astronomer (1650-1695).
Arrhenius,Arrhenius,Moon,40.93,-55.58,-91.45,"Planetographic, +East, -180 - 180","Crater, craters",Approved,Svante August; Swedish chemist; Nobel laureate (1859-1927).
Artamonov,Artamonov,Moon,62.45,25.44,103.79,"Planetographic, +East, -180 - 180","Crater, craters",Approved,Nikolaj N.; Soviet rocket scientist (1906-1965).
Artem'ev,Artem ev,Moon,66.39,10.40,-145.22,"Planetographic, +East, -180 - 180","Crater, craters",Approved,Vladimir Andreevich; Soviet rocket scientist (1885-1962).
Artemis,Artemis,Moon,2.28,25.03,-25.36,"Planetographic, +East, -180 - 180","Crater, craters",Approved,Greek female first name.
Artsimovich,Artsimovich,Moon,7.96,27.61,-36.63,"Planetographic, +East, -180 - 180","Crater, craters",Approved,Lev Andreevich; Soviet physicist (1909-1973).
Aryabhata,Aryabhata,Moon,21.89,6.20,35.17,"Planetographic, +East, -180 - 180","Crater, craters",Approved,"Aryabhata I; Indian astronomer, mathematician (476-c.550)."
Arzachel,Arzachel,Moon,96.99,-18.26,-1.93,"Planetographic, +East, -180 - 180","Crater, craters",Approved,Al-Zarqālī; Spanish-Arabic astronomer (died 1100).
Asada,Asada,Moon,12.37,7.25,49.90,"Planetographic, +East, -180 - 180","Crater, craters",Approved,Goryu; Japanese astronomer (1734-1799).
Asclepi,Asclepi,Moon,40.56,-55.19,25.52,"Planetographic, +East, -180 - 180","Crater, craters",Approved,Giuseppe Maria; Italian astronomer (1706-1776).
Ashbrook,Ashbrook,Moon,157.68,-81.10,-110.58,"Planetographic, +East, -180 - 180","Crater, craters",Approved,Joseph; American astronomer (1918-1980).
Aston,Aston,Moon,44.48,32.77,-87.68,"Planetographic, +East, -180 - 180","Crater, craters",Approved,"Francis William; British chemist, physicist; Nobel laureate (1877-1945)."
Atlas,Atlas,Moon,88.12,46.74,44.38,"Planetographic, +East, -180 - 180","Crater, craters",Approved,Mythological Greek Titan.
Atwood,Atwood,Moon,28.64,-5.88,57.78,"Planetographic, +East, -180 - 180","Crater, craters",Approved,"George; British mathematician, physicist (1746-1807)."
Autolycus,Autolycus,Moon,38.88,30.68,1.49,"Planetographic, +East, -180 - 180","Crater, craters",Approved,Autolycus of Pitane; Greek astronomer (fl. c. 310 B.C.).
Auwers,Auwers,Moon,19.64,15.00,17.12,"Planetographic, +East, -180 - 180","Crater, craters",Approved,Georg Friedrich Julius Arthur; German astronomer (1838-1915).
Auzout,Auzout,Moon,32.92,10.21,64.01,"Planetographic, +East, -180 - 180","Crater, craters",Approved,"Adrien; French astronomer, physicist (1622-1691)."
Avery,Avery,Moon,10.73,-1.32,81.37,"Planetographic, +East, -180 - 180","Crater, craters",Approved,Oswald Theodore; Canadian doctor (1877-1955).
Avicenna,Avicenna,Moon,72.99,39.63,-97.28,"Planetographic, +East, -180 - 180","Crater, craters",Approved,Abu Ali Al-Hussein Ibn Abdallah; Persian doctor (980-1037).
Avogadro,Avogadro,Moon,129.84,63.21,165.36,"Planetographic, +East, -180 - 180","Crater, craters",Approved,Amedeo (Conte Di Quarengna); Italian physicist (1776-1856).
Azophi,Azophi,Moon,47.54,-22.19,12.70,"Planetographic, +East, -180 - 180","Crater, craters",Approved,"Al-Sufi, Abderrahman; Persian astronomer (903-986)."
Baade,Baade,Moon,57.85,-44.75,-82.03,"Planetographic, +East, -180 - 180","Crater, craters",Approved,Wilhelm Heinrich Walter; American astronomer (1893-1960).
Babakin,Babakin,Moon,19.15,-20.81,123.26,"Planetographic, +East, -180 - 180","Crater, craters",Approved,Georgii Nikolaevich; Soviet space scientist (1914-1971).
Babbage,Babbage,Moon,146.56,59.56,-57.38,"Planetographic, +East, -180 - 180","Crater, craters",Approved,Charles; British mathematician (1792-1871).
Babcock,Babcock,Moon,95.28,4.13,94.14,"Planetographic, +East, -180 - 180","Crater, craters",Approved,"Harold Delos; American astronomer, physicist (1882-1968)."
Back,Back,Moon,34.63,1.20,80.67,"Planetographic, +East, -180 - 180","Crater, craters",Approved,Ernst Emil Alexander; German physicist (1881-1959).
Backlund,Backlund,Moon,75.46,-16.22,103.35,"Planetographic, +East, -180 - 180","Crater, craters",Approved,Jöns Oskar; Russian astronomer (1846-1916).
Baco,Baco,Moon,65.31,-51.04,19.10,"Planetographic, +East, -180 - 180","Crater, craters",Approved,"Bacon, Roger; British natural philosopher, optician (c. 1214-c. 1294)."
Baillaud,Baillaud,Moon,89.44,74.61,37.35,"Planetographic, +East, -180 - 180","Crater, craters",Approved,(Édouard) Benjamin; French astronomer (1848-1934).
Bailly,Bailly,Moon,300.56,-66.82,-68.90,"Planetographic, +East, -180 - 180","Crater, craters",Approved,Jean Sylvain; French astronomer (1736-1793).
Baily,Baily,Moon,25.68,49.78,30.56,"Planetographic, +East, -180 - 180","Crater, craters",Approved,Francis; British astronomer (1774-1844).
Balandin,Balandin,Moon,11.81,-18.94,152.58,"Planetographic, +East, -180 - 180","Crater, craters",Approved,Aleksey Aleksandrovich; Soviet chemist (1898-1967).
Balboa,Balboa,Moon,69.19,19.24,-83.31,"Planetographic, +East, -180 - 180","Crater, craters",Approved,Vasco Nuñez de; Spanish explorer (1475-1519).
Baldet,Baldet,Moon,55.76,-53.32,-151.96,"Planetographic, +East, -180 - 180","Crater, craters",Approved,Fernand; French astronomer (1885-1964).
Ball,Ball,Moon,40.31,-35.92,-8.39,"Planetographic, +East, -180 - 180","Crater, craters",Approved,William; British astronomer (unkn-1690).
Ballet,Ballet,Moon,0.01,20.17,30.57,"Planetographic, +East, -180 - 180","Crater, craters",Approved,"Astronaut-named feature, Apollo 17 site."
Balmer,Balmer,Moon,136.30,-20.27,70.22,"Planetographic, +East, -180 - 180","Crater, craters",Approved,"Johann Jakob; Swiss mathematician, physician (1825-1898)."
Banachiewicz,Banachiewicz,Moon,99.09,5.28,80.01,"Planetographic, +East, -180 - 180","Crater, craters",Approved,"Tadeusz; Polish astronomer, mathematician (1882-1954)."
Bancroft,Bancroft,Moon,12.50,28.07,-6.43,"Planetographic, +East, -180 - 180","Crater, craters",Approved,Wilder Dwight; American chemist (1867-1953).
Bandfield,Bandfield,Moon,1.00,-5.40,90.77,"Planetographic, +East, -180 - 180","Crater, craters",Approved,Joshua; American planetary scientist (1974-2019).
Banting,Banting,Moon,5.15,26.58,16.43,"Planetographic, +East, -180 - 180","Crater, craters",Approved,Sir Frederick Grant; Canadian doctor; Nobel laureate (1891-1941).
Barbier,Barbier,Moon,65.38,-23.85,157.93,"Planetographic, +East, -180 - 180","Crater, craters",Approved,Daniel; French astronomer (1907-1965).
Barkla,Barkla,Moon,40.90,-10.67,67.22,"Planetographic, +East, -180 - 180","Crater, craters",Approved,Charles Glover; British physicist; Nobel laureate (1877-1944).
Barnard,Barnard,Moon,115.73,-29.79,85.95,"Planetographic, +East, -180 - 180","Crater, craters",Approved,Edward Emerson; American astronomer (1857-1923).
Barocius,Barocius,Moon,82.72,-44.98,16.81,"Planetographic, +East, -180 - 180","Crater, craters",Approved,Francesco; Italian mathematician (1537-1604).
Barringer,Barringer,Moon,66.89,-28.22,-150.43,"Planetographic, +East, -180 - 180","Crater, craters",Approved,"Daniel Moreau; American engineer, geologist (1860-1929)."
Barrow,Barrow,Moon,93.82,71.28,7.59,"Planetographic, +East, -180 - 180","Crater, craters",Approved,Isaac; British mathematician (1630-1677).
Bartels,Bartels,Moon,54.95,24.51,-89.85,"Planetographic, +East, -180 - 180","Crater, craters",Approved,Julius; German geophysicist (1899-1964).
Bawa,Bawa,Moon,1.57,-25.28,102.56,"Planetographic, +East, -180 - 180","Crater, craters",Approved,African male name.
Bayer,Bayer,Moon,48.51,-51.62,-35.14,"Planetographic, +East, -180 - 180","Crater, craters",Approved,Johann; German astronomer (1572-1625).
Beals,Beals,Moon,52.61,37.11,86.58,"Planetographic, +East, -180 - 180","Crater, craters",Approved,Carlyle Smith; Canadian astronomer (1899-1979).
Beaumont,Beaumont,Moon,50.69,-18.08,28.82,"Planetographic, +East, -180 - 180","Crater, craters",Approved,Jean-Baptiste-Armand-Louis-Léonce Élie de; French geologist (1798-1874).
Becquerel,Becquerel,Moon,62.86,40.79,129.50,"Planetographic, +East, -180 - 180","Crater, craters",Approved,Antoine-Henri; French physicist; Nobel laureate (1852-1908).
Bečvář,Becvar,Moon,66.62,-2.57,125.07,"Planetographic, +East, -180 - 180","Crater, craters",Approved,Antonin; Czechoslovakian astronomer (1901-1965).
Beer,Beer,Moon,9.06,27.07,-9.10,"Planetographic, +East, -180 - 180","Crater, craters",Approved,Wilhelm; German astronomer (1797-1850).
Behaim,Behaim,Moon,56.21,-16.61,79.41,"Planetographic, +East, -180 - 180","Crater, craters",Approved,"Martin; German navigator, cartographer (1459-1507)."
Beijerinck,Beijerinck,Moon,76.77,-13.40,151.84,"Planetographic, +East, -180 - 180","Crater, craters",Approved,Martinus Willem; Dutch botanist (1851-1931).
Beketov,Beketov,Moon,8.30,16.23,29.18,"Planetographic, +East, -180 - 180","Crater, craters",Approved,Nikolai Nikolaevich; Russian chemist (1827-1911).
Béla,Bela,Moon,10.07,24.67,2.27,"Planetographic, +East, -180 - 180","Crater, craters",Approved,"Hungarian male name, also Slovak female name."
Bel'kovich,Belkovich,Moon,215.08,61.53,90.15,"Planetographic, +East, -180 - 180","Crater, craters",Approved,Igor V.; Soviet astronomer (1904-1949).
Bell,Bell,Moon,86.33,21.98,-96.53,"Planetographic, +East, -180 - 180","Crater, craters",Approved,Alexander Graham; Scottish-American inventor (1847-1922).
Bellinsgauzen (Bellingshausen),Bellinsgauzen  Bellingshausen,Moon,63.23,-60.72,-164.85,"Planetographic, +East, -180 - 180","Crater, craters",Approved,Faddei Faddeevich; Russian explorer (1778-1852).
Bellot,Bellot,Moon,17.50,-12.48,48.19,"Planetographic, +East, -180 - 180","Crater, craters",Approved,Joseph Rene; French explorer (1826-1853).
Belopol'skiy,Belopol skiy,Moon,61.90,-17.25,-128.23,"Planetographic, +East, -180 - 180","Crater, craters",Approved,Aristarch Apollonovich; Russian astronomer (1854-1934).
Belyaev,Belyaev,Moon,55.90,23.10,143.11,"Planetographic, +East, -180 - 180","Crater, craters",Approved,Pavel Ivanovich; Soviet cosmonaut (1925-1970).
Benedict,Benedict,Moon,13.83,4.35,141.54,"Planetographic, +East, -180 - 180","Crater, craters",Approved,"Francis Gano; American chemist, physiologist (1870-1957)."
Bergman,Bergman,Moon,22.51,6.97,137.49,"Planetographic, +East, -180 - 180","Crater, craters",Approved,"Torbern Olof; Swedish chemist, mineralogist, astronomer (1735-1784)."
Bergstrand,Bergstrand,Moon,42.98,-18.72,176.44,"Planetographic, +East, -180 - 180","Crater, craters",Approved,Carl Östen Emanuel; Swedish astronomer (1873-1948).
Berkner,Berkner,Moon,87.62,25.13,-105.24,"Planetographic, +East, -180 - 180","Crater, craters",Approved,Lloyd Viel; American geophysicist (1905-1967).
Berlage,Berlage,Moon,93.75,-63.04,-163.61,"Planetographic, +East, -180 - 180","Crater, craters",Approved,"Hendrik Petrus; Dutch geophysicist, meteorologist (1896-1968)."
Bernoulli,Bernoulli,Moon,47.30,34.93,60.61,"Planetographic, +East, -180 - 180","Crater, craters",Approved,Jacques; Swiss mathematician (1654-1705); Jean; Swiss mathematician (1667-1748). (Spelling changed from Bernouilli.)
Berosus,Berosus,Moon,75.24,33.50,69.99,"Planetographic, +East, -180 - 180","Crater, craters",Approved,Berosus the Chaldean; Babylonian astronomer (unkn-c. 250 B.C.).
Berzelius,Berzelius,Moon,48.53,36.55,50.95,"Planetographic, +East, -180 - 180","Crater, craters",Approved,Jöns Jacob; Swedish chemist (1779-1848).
Bessarion,Bessarion,Moon,9.84,14.85,-37.31,"Planetographic, +East, -180 - 180","Crater, craters",Approved,John; Greek scholar (1403-1472).
Bessel,Bessel,Moon,15.56,21.73,17.92,"Planetographic, +East, -180 - 180","Crater, craters",Approved,Friedrich Wilhelm; German astronomer (1784-1846).
Bettinus,Bettinus,Moon,71.78,-63.40,-45.16,"Planetographic, +East, -180 - 180","Crater, craters",Approved,"Mario; Italian mathematician, astronomer (1582-1657)."
Bhabha,Bhabha,Moon,70.25,-55.50,-165.31,"Planetographic, +East, -180 - 180","Crater, craters",Approved,Homi Jehangir; Indian physicist (1909-1966).
Bianchini,Bianchini,Moon,37.59,48.78,-34.37,"Planetographic, +East, -180 - 180","Crater, craters",Approved,Francesco; Italian astronomer (1662-1729).
Biela,Biela,Moon,77.03,-54.99,51.63,"Planetographic, +East, -180 - 180","Crater, craters",Approved,Wilhelm von; Austrian astronomer (1782-1856).
Bilharz,Bilharz,Moon,44.55,-5.83,56.34,"Planetographic, +East, -180 - 180","Crater, craters",Approved,"Theodor; German doctor, zoologist (1825-1862)."
Billy,Billy,Moon,45.57,-13.83,-50.24,"Planetographic, +East, -180 - 180","Crater, craters",Approved,Jacques de; French mathematician (1602-1679).
Bingham,Bingham,Moon,34.99,8.02,115.05,"Planetographic, +East, -180 - 180","Crater, craters",Approved,Hiram; American explorer (1875-1956).
Biot,Biot,Moon,13.01,-22.70,51.08,"Planetographic, +East, -180 - 180","Crater, craters",Approved,Jean-Baptiste; French astronomer (1774-1862).
Birkeland,Birkeland,Moon,81.64,-30.17,174.01,"Planetographic, +East, -180 - 180","Crater, craters",Approved,Olaf Kristian; Norwegian physicist (1867-1917).
Birkhoff,Birkhoff,Moon,329.81,58.45,-145.65,"Planetographic, +East, -180 - 180","Crater, craters",Approved,George David; American mathematician (1884-1944).
Birmingham,Birmingham,Moon,89.92,65.12,-10.70,"Planetographic, +East, -180 - 180","Crater, craters",Approved,John; Irish astronomer (1816-1884).
Birt,Birt,Moon,15.81,-22.36,-8.59,"Planetographic, +East, -180 - 180","Crater, craters",Approved,William R.; British selenographer (1804-1881).
Bi Sheng,Bi Sheng,Moon,55.27,78.35,148.46,"Planetographic, +East, -180 - 180","Crater, craters",Approved,Chinese inventor (c. 990-1051).
Bjerknes,Bjerknes,Moon,48.18,-38.50,113.69,"Planetographic, +East, -180 - 180","Crater, craters",Approved,Vilhelm Friman Koren; Norwegian physicist (1862-1951).
